[
  {
    "id": "oana-goga",
    "name": "Oana Goga",
    "dblpAuthorId": "Oana Goga",
    "aliases": [],
    "work": {
      "institution": "CNRS",
      "note": "Official CNRS-affiliated institutional CV identifies her as a CNRS-affiliated researcher."
    },
    "tracking": {
      "status": "active",
      "priority": 1115,
      "note": "Official institutional CV provides explicit undergraduate, master's, doctoral, advisor, and postdoctoral lineage.",
      "analyzedAt": null
    },
    "source": {
      "label": "LIX-hosted CV",
      "url": "https://www.lix.polytechnique.fr/~goga/assets/PDFs/CV_OanaGoga_long.pdf"
    },
    "sources": [
      {
        "kind": "ranking",
        "url": "https://nebelwelt.net/pubstats/top-authors-sys_sec.html",
        "confidence": "medium",
        "note": "Ranking page provides a DBLP author id and a current affiliation, but no lineage details."
      },
      {
        "kind": "cv",
        "url": "https://www.lix.polytechnique.fr/~goga/assets/PDFs/CV_OanaGoga_long.pdf",
        "confidence": "high",
        "note": "The official institutional CV lists `Ph.D. in Computer Science, Université Pierre et Marie Curie (UPMC), May 2014`; advisor `Renata Teixeira`; `M.Sc. in Computer Networks, UPMC, September 2010`; advisor `Renata Teixeira`; `Engineering Degree in Computer Science, Technical University of Cluj-Napoca, September 2008`; advisors `Jérôme Gallard, Adrien Lèbre, Christine Morin, and Vasile Dadarlat`; and `Postdoctoral researcher at MPI-SWS, June 2014 to September 2017`; advisor `Krishna P. Gummadi`."
      }
    ],
    "summary": "The official institutional CV states that Oana Goga earned an engineering degree in Computer Science from the Technical University of Cluj-Napoca, an M.Sc. in Computer Networks from UPMC advised by Renata Teixeira, a PhD in Computer Science from UPMC also advised by Renata Teixeira, and later held a postdoc at MPI-SWS with Krishna P. Gummadi.",
    "stages": {
      "undergraduate": {
        "school": "Technical University of Cluj-Napoca",
        "note": "The official institutional CV lists `Engineering Degree in Computer Science, Technical University of Cluj-Napoca, September 2008`."
      },
      "masters": {
        "school": "Université Pierre et Marie Curie (UPMC)",
        "note": "The official institutional CV lists `M.Sc. in Computer Networks, UPMC, September 2010` and names advisor `Renata Teixeira`."
      },
      "phd": {
        "school": "Université Pierre et Marie Curie (UPMC)",
        "advisorPersonId": null,
        "advisorLabel": "Renata Teixeira",
        "status": "Ph.D. in Computer Science",
        "note": "The official institutional CV lists `Ph.D. in Computer Science, Université Pierre et Marie Curie (UPMC), May 2014` and names advisor `Renata Teixeira`.",
        "graduationYear": null
      },
      "postdoc": {
        "school": "MPI-SWS",
        "advisorPersonId": null,
        "advisorLabel": "Krishna P. Gummadi",
        "status": "Postdoctoral researcher",
        "note": "The official institutional CV lists `Postdoctoral researcher at MPI-SWS, June 2014 to September 2017` and names advisor `Krishna P. Gummadi`."
      }
    }
  },
  {
    "id": "octavian-suciu",
    "name": "Octavian Suciu",
    "dblpAuthorId": "Octavian Suciu",
    "aliases": [],
    "work": {
      "institution": "Google (United States)",
      "note": "Current affiliation confirmed from public ORCID employment data discovered via exact CSrankings join."
    },
    "tracking": {
      "status": "seed",
      "priority": 2776,
      "note": "Imported from the top-authors system security ranking page.",
      "analyzedAt": null
    },
    "source": {
      "label": "Top Authors Ranking",
      "url": "https://nebelwelt.net/pubstats/top-authors-sys_sec.html"
    },
    "sources": [
      {
        "kind": "ranking",
        "url": "https://nebelwelt.net/pubstats/top-authors-sys_sec.html",
        "confidence": "medium",
        "note": "Ranking page provides a DBLP author id and a current affiliation, but no lineage details."
      },
      {
        "kind": "orcid",
        "url": "https://orcid.org/0009-0007-4114-7796",
        "confidence": "medium",
        "note": "Public ORCID employment data indicates current affiliation Google (United States)."
      }
    ],
    "summary": "Imported as a ranking-page seed with DBLP identity and current work institution. Lineage details remain to be scanned from official sources.",
    "stages": {
      "undergraduate": {
        "school": null,
        "note": "Pending scan."
      },
      "masters": {
        "school": null,
        "note": "Pending scan."
      },
      "phd": {
        "school": null,
        "advisorPersonId": null,
        "advisorLabel": null,
        "status": null,
        "note": "Pending scan.",
        "graduationYear": null
      },
      "postdoc": {
        "school": null,
        "advisorPersonId": null,
        "advisorLabel": null,
        "status": null,
        "note": "Pending scan."
      }
    }
  },
  {
    "id": "oguzhan-ersoy",
    "name": "Oguzhan Ersoy",
    "dblpAuthorId": "Oguzhan Ersoy",
    "aliases": [],
    "work": {
      "institution": "TU Delft",
      "note": "The official TU Delft dissertation PDF identifies him as a TU Delft researcher."
    },
    "tracking": {
      "status": "active",
      "priority": 1737,
      "note": "Official TU Delft dissertation PDF provides explicit master's, dual-bachelor, doctoral advisor, and postdoctoral history.",
      "analyzedAt": "2026-07-14T19:07:19.661Z"
    },
    "source": {
      "label": "TU Delft dissertation PDF",
      "url": "https://pure.tudelft.nl/ws/portalfiles/portal/97717964/Oguzhan_Ersoy_dissertation.pdf"
    },
    "sources": [
      {
        "kind": "ranking",
        "url": "https://nebelwelt.net/pubstats/top-authors-sys_sec.html",
        "confidence": "medium",
        "note": "Ranking page provides a DBLP author id and a current affiliation, but no lineage details."
      },
      {
        "kind": "thesis",
        "url": "https://pure.tudelft.nl/ws/portalfiles/portal/97717964/Oguzhan_Ersoy_dissertation.pdf",
        "confidence": "high",
        "note": "The official TU Delft dissertation PDF states that Oguzhan Ersoy earned an M.Sc. in Electrical & Electronics Engineering from Boğaziçi University, dual B.Sc. honour degrees in Electrical & Electronics Engineering and Mathematics, completed PhD work under R.L. Lagendijk and Z. Erkin, and later was a post-doctoral researcher in the Distributed Systems Group at TU Delft."
      }
    ],
    "summary": "The official TU Delft dissertation PDF states that Oguzhan Ersoy earned an M.Sc. in Electrical & Electronics Engineering from Boğaziçi University, dual B.Sc. honour degrees, completed PhD work under R.L. Lagendijk and Z. Erkin, and later was a post-doctoral researcher at TU Delft.",
    "stages": {
      "undergraduate": {
        "school": null,
        "note": "The official TU Delft dissertation PDF states that Oguzhan Ersoy earned `B.Sc. honor degrees in Electrical & Electronics Engineering and Mathematics in 2012`, but the reviewed extract does not restate the granting institution."
      },
      "masters": {
        "school": "Boğaziçi University",
        "note": "The official TU Delft dissertation PDF states that Oguzhan Ersoy earned a `Master of Science in Electrical & Electronics Engineering, Boğaziçi University, Turkey`."
      },
      "phd": {
        "school": "TU Delft",
        "advisorPersonId": null,
        "advisorLabel": "R.L. Lagendijk; Z. Erkin",
        "status": "PhD work",
        "note": "The official TU Delft dissertation PDF states that Oguzhan Ersoy's `PhD work` was under the supervision of Prof.dr.ir. R.L. Lagendijk and Dr. Z. Erkin.",
        "graduationYear": null
      },
      "postdoc": {
        "school": "TU Delft",
        "advisorPersonId": null,
        "advisorLabel": null,
        "status": "post-doctoral researcher",
        "note": "The official TU Delft dissertation PDF states that Oguzhan Ersoy was a `post-doctoral researcher in the Distributed Systems Group of Delft University of Technology`."
      }
    }
  },
  {
    "id": "oleksii-oleksenko",
    "name": "Oleksii Oleksenko",
    "dblpAuthorId": "Oleksii Oleksenko",
    "aliases": [],
    "work": {
      "institution": null,
      "note": "The ranking page lists this person but does not provide a current work institution."
    },
    "tracking": {
      "status": "seed",
      "priority": 2969,
      "note": "Imported from the top-authors system security ranking page.",
      "analyzedAt": "2026-07-15T18:15:54.504Z"
    },
    "source": {
      "label": "Top Authors Ranking",
      "url": "https://nebelwelt.net/pubstats/top-authors-sys_sec.html"
    },
    "sources": [
      {
        "kind": "ranking",
        "url": "https://nebelwelt.net/pubstats/top-authors-sys_sec.html",
        "confidence": "medium",
        "note": "Ranking page provides a DBLP author id and a current affiliation, but no lineage details."
      }
    ],
    "summary": "Imported as a ranking-page seed with DBLP identity and current work institution. Lineage details remain to be scanned from official sources.",
    "stages": {
      "undergraduate": {
        "school": null,
        "note": "Pending scan."
      },
      "masters": {
        "school": null,
        "note": "Pending scan."
      },
      "phd": {
        "school": null,
        "advisorPersonId": null,
        "advisorLabel": null,
        "status": null,
        "note": "Pending scan.",
        "graduationYear": null
      },
      "postdoc": {
        "school": null,
        "advisorPersonId": null,
        "advisorLabel": null,
        "status": null,
        "note": "Pending scan."
      }
    }
  },
  {
    "id": "oleksii-starov",
    "name": "Oleksii Starov",
    "dblpAuthorId": "Oleksii Starov",
    "aliases": [],
    "work": {